pregunta,opcion_a,opcion_b,opcion_c,opcion_d,respuesta_correcta,explicacion,categoria,dificultad,tags
"¿Cuál es la dosis de mantenimiento habitual de ácido acetilsalicílico en prevención cardiovascular secundaria?","75-100 mg/día","150-300 mg/día","325-650 mg/día","1000 mg/día",1,"La dosis de mantenimiento de AAS en prevención secundaria es 75-100 mg/día para reducir el riesgo de eventos cardiovasculares.","Riesgo Vascular","Básico","ras;prevencion-secundaria;cardiologia"
"En el PAI de Riesgo Vascular, ¿cuál es el objetivo de LDL en pacientes con riesgo muy alto?","<70 mg/dl","<100 mg/dl","<130 mg/dl","<160 mg/dl",1,"En pacientes de riesgo muy alto cardiovascular, el objetivo de LDL debe ser <70 mg/dl según las guías europeas.","Riesgo Vascular","Intermedio","ldl;colesterol;riesgo-cardiovascular"
"¿Cuál es el antihipertensivo de primera línea en pacientes diabéticos con microalbuminuria?","Diuréticos tiazídicos","Calcioantagonistas","IECA o ARA-II","Betabloqueantes",3,"Los IECA o ARA-II son de primera línea en diabéticos con microalbuminuria por su efecto nefroprotector.","Diabetes Mellitus","Intermedio","ieca;ara2;nefroproteccion;microalbuminuria"
"Según el PAI de EPOC, ¿cuál es la indicación principal para oxigenoterapia domiciliaria?","PaO2 < 60 mmHg","PaO2 < 55 mmHg","Disnea de reposo","FEV1 < 50%",2,"La oxigenoterapia domiciliaria está indicada cuando PaO2 < 55 mmHg en situación de estabilidad clínica.","EPOC","Avanzado","oxigenoterapia;pao2;insuficiencia-respiratoria"
"En Cuidados Paliativos, ¿cuál es la dosis de rescate de morfina oral recomendada?","5-10% de la dosis diaria","10-15% de la dosis diaria","15-20% de la dosis diaria","20-25% de la dosis diaria",2,"La dosis de rescate debe ser 10-15% de la dosis total diaria de morfina, administrada cada 4 horas si es necesario.","Cuidados Paliativos","Avanzado","morfina;rescate;dolor-irruptivo"
